{
  "schema": "token-firewall/risk-token-budget-policy@0.1",
  "object_id": "budget_default_risk_tiers",
  "revision": 1,
  "created_at": "2026-07-11T00:00:00+08:00",
  "content_sha256": "c6b8cca0ebbbe7240bda29d10953495c93aa138eb2843aeda086d9d674329665",
  "tiers": {
    "low": {
      "required_review": "m3-then-sol",
      "planning_sol_max": 10000,
      "review_sol_max": 50000,
      "total_sol_max": 60000,
      "minimum_sol_savings_percent": 80,
      "max_rework_rounds": 1
    },
    "medium": {
      "required_review": "terra-then-sol",
      "planning_sol_max": 20000,
      "review_sol_max": 180000,
      "total_sol_max": 200000,
      "minimum_sol_savings_percent": 70,
      "max_rework_rounds": 2
    },
    "high": {
      "required_review": "sol-deep-review",
      "planning_sol_max": 50000,
      "review_sol_max": 350000,
      "total_sol_max": 400000,
      "minimum_sol_savings_percent": 60,
      "max_rework_rounds": 2
    },
    "critical": {
      "required_review": "sol-deep-review",
      "planning_sol_max": 100000,
      "review_sol_max": 600000,
      "total_sol_max": 700000,
      "minimum_sol_savings_percent": 50,
      "max_rework_rounds": 1
    }
  }
}
